{"schema":"qsol-fed-lean-phase10-manifest/1","protocol":"qsol-fed/0","phase":10,"status":"LEAN_VERIFIED_ON_BRANCH","formalization_scope":"selected constitutional and protocol separation invariants from immutable QSOL-FED v0.11.0; not whole-software verification","source_release":{"id":377808649,"tag":"v0.11.0","immutable":true,"commit":"c953463724cdf218802e66e16f582ae8d600ca47","tree":"93f23cd7eda6dd92ae13b7bb96bee01935b80731","published_at":"2026-08-27T12:35:21Z"},"moriarty_binding":{"protocol":"MORIARTY/1","workflow_run":33069191846,"run_number":413,"artifact_id":9645064099,"artifact_digest":"sha256:1c77cb56e83a0af19961e9f3c99d3ace02f6dd905655dc64b36aa90d46e9d9ce","target_commit":"c953463724cdf218802e66e16f582ae8d600ca47","corpus_ref":"sha256:af50e8145a72a1a583ede29687535a59c0e17ac37fdd66e1ede51c453e8fd3e6","family_count":15,"executed_probe_count":13,"unresolved_counterexamples":0,"graduated":true,"security_proof":false,"report_path":"evidence/phase10/moriarty-report-c953463724cdf218802e66e16f582ae8d600ca47.json","report_sha256":"sha256:6c215f44a1c52aa3bfefadc4039013ea69ddbe0f2afd06f6dac27377369b185c"},"toolchain":{"lean":"v4.33.1","lean_toolchain":"leanprover/lean4:v4.33.1","archive_url":"https://github.com/leanprover/lean4/releases/download/v4.33.1/lean-4.33.1-linux.tar.zst","archive_sha256":"890afd185370f85666025b883914ab4f4b339136f8c96167b69cfb62aecaf235","external_dependencies":[]},"frozen_inputs":[{"path":"ROADMAP.md","git_blob_sha1":"42db05b1106e11cfb116920a5f4d8a2d92d60a66"},{"path":"PRIME_DIRECTIVE.md","git_blob_sha1":"ad6b5cdae5f8ada9b48f8066e3cb0f68ac9a6c93"},{"path":"invariants/fed-v1.json","git_blob_sha1":"97b62def1fd42cdc78cb178cddc9f269c98c620b"},{"path":"wire/phase1.json","git_blob_sha1":"1d34ac72d5d07c3f6b5bd28337eb6606cf44e782"},{"path":"crypto/phase2.json","git_blob_sha1":"042a850ccef4a058be595e955a87797d5e108e47"},{"path":"state/phase4.json","git_blob_sha1":"c9d7bcfcab9cd4581dc179a56071d7da1df97b13"},{"path":"state/phase5a-holodeck.json","git_blob_sha1":"bbb030469dcd66f4af37664c732820e6b6f0d760"},{"path":"state/phase5.json","git_blob_sha1":"5d2c22c46e9059668054a1dcb64facf071334505"},{"path":"state/phase6.json","git_blob_sha1":"c4eafb645c888d97f1d38e5eb1fe600e5aa49d0e"},{"path":"state/phase7.json","git_blob_sha1":"458c28c8ac075a6b3dcc2ea7189c3c77f0170a71"},{"path":"state/phase8.json","git_blob_sha1":"b855104b4fe4c97342b5bd48b248ca915e578703"},{"path":"state/phase9.json","git_blob_sha1":"c2bd1415cc86d27873a4432adb00d2306b87dbb0"},{"path":"claims/phase9.json","git_blob_sha1":"9ee94894169b0085c7282ac6c98a51b794eb0221"},{"path":"fixtures/phase9/attack-corpus.json","git_blob_sha1":"77d1a04e0912eec98613fc496478a04e6bae6cd6"},{"path":"schemas/moriarty-report-v1.schema.json","git_blob_sha1":"2c1992a796c48265309770653923effdb65b4f79"}],"schema_binding":{"rule":"all schema files used by the frozen contracts are transitively bound by the exact v0.11.0 Git tree; the MORIARTY report schema is additionally named by blob identity","source_tree":"93f23cd7eda6dd92ae13b7bb96bee01935b80731"},"assumptions":[{"id":"MODEL_SCOPE","statement":"Lean definitions are an abstract formalization of stated v0.11.0 contract semantics; correspondence to every implementation path remains an external verification obligation."},{"id":"CANONICAL_BYTES_INPUT","statement":"canonical_identity_deterministic assumes the compared canonical byte sequences are equal; it does not prove canonicalizer implementation correctness or SHA-256 collision resistance."},{"id":"REAL_WORLD_PRINCIPALS","statement":"real-world principal uniqueness, deployment hardening, host isolation and operational credential hygiene are outside the theorem model unless explicitly represented."}],"nonclaims":["LEAN_THEOREM != DEPLOYMENT_SECURITY_PROOF","FORMAL_MODEL != UNSTATED_REAL_WORLD_ASSUMPTION","LEAN_MODEL != COMPLETE_RUST_IMPLEMENTATION_VERIFICATION","MORIARTY_REPORT != SECURITY_PROOF","TARGET_BOUND_SOURCE_RELEASE != POST_TAG_FORMALIZATION_LAYER"],"graduation_requirements":{"no_unresolved_sorry_or_admit":true,"named_assumptions_required":true,"theorem_to_contract_traceability_required":true,"clean_checkout_build_required":true,"custom_axioms_allowed":[]},"theorem_count":47,"theorems":[{"id":"FED-LEAN-001","declaration":"prime_directive_accepts_data_only","module":"QSOLFed.Theorems","path":"QSOLFed/Theorems.lean","source_refs":["PRIME_DIRECTIVE.md","invariants/fed-v1.json"],"contract_ids":["prime_directive_local_admission"],"proof_status":"IMPLEMENTED"},{"id":"FED-LEAN-002","declaration":"prime_directive_quarantines_foreign_state","module":"QSOLFed.Theorems","path":"QSOLFed/Theorems.lean","source_refs":["PRIME_DIRECTIVE.md","invariants/fed-v1.json"],"contract_ids":["foreign_state_is_not_local_state"],"proof_status":"IMPLEMENTED"},{"id":"FED-LEAN-003","declaration":"prime_directive_rejects_governance_mutation","module":"QSOLFed.Theorems","path":"QSOLFed/Theorems.lean","source_refs":["PRIME_DIRECTIVE.md","invariants/fed-v1.json"],"contract_ids":["remote_governance_mutation_forbidden","remote_vote_creation_forbidden","remote_capability_installation_forbidden","remote_history_rewrite_forbidden","remote_citizenship_mutation_forbidden","remote_local_authority_claim_forbidden","secrets_in_semantic_state_forbidden"],"proof_status":"IMPLEMENTED"},{"id":"FED-LEAN-004","declaration":"prime_directive_rejects_evidence_promotion","module":"QSOLFed.Theorems","path":"QSOLFed/Theorems.lean","source_refs":["PRIME_DIRECTIVE.md","invariants/fed-v1.json"],"contract_ids":["remote_evidence_promotion_forbidden"],"proof_status":"IMPLEMENTED"},{"id":"FED-LEAN-005","declaration":"prime_directive_rejects_arbitrary_execution","module":"QSOLFed.Theorems","path":"QSOLFed/Theorems.lean","source_refs":["PRIME_DIRECTIVE.md","invariants/fed-v1.json"],"contract_ids":["remote_arbitrary_execution_forbidden"],"proof_status":"IMPLEMENTED"},{"id":"FED-LEAN-006","declaration":"prime_directive_rejects_runtime_override","module":"QSOLFed.Theorems","path":"QSOLFed/Theorems.lean","source_refs":["PRIME_DIRECTIVE.md","invariants/fed-v1.json"],"contract_ids":["runtime_constitution_override_forbidden"],"proof_status":"IMPLEMENTED"},{"id":"FED-LEAN-007","declaration":"prime_directive_rejects_unknown_authority","module":"QSOLFed.Theorems","path":"QSOLFed/Theorems.lean","source_refs":["PRIME_DIRECTIVE.md","invariants/fed-v1.json"],"contract_ids":["unknown_authority_action_rejected"],"proof_status":"IMPLEMENTED"},{"id":"FED-LEAN-008","declaration":"signature_validity_does_not_create_trust","module":"QSOLFed.Theorems","path":"QSOLFed/Theorems.lean","source_refs":["crypto/phase2.json","PRIME_DIRECTIVE.md","invariants/fed-v1.json"],"contract_ids":["signature_validity_is_trust=false"],"proof_status":"IMPLEMENTED"},{"id":"FED-LEAN-009","declaration":"signature_validity_does_not_create_authority","module":"QSOLFed.Theorems","path":"QSOLFed/Theorems.lean","source_refs":["crypto/phase2.json","PRIME_DIRECTIVE.md","invariants/fed-v1.json"],"contract_ids":["signature_validity_is_authority=false"],"proof_status":"IMPLEMENTED"},{"id":"FED-LEAN-010","declaration":"valid_signature_does_not_bypass_local_rejection","module":"QSOLFed.Theorems","path":"QSOLFed/Theorems.lean","source_refs":["crypto/phase2.json","PRIME_DIRECTIVE.md","invariants/fed-v1.json"],"contract_ids":["signature_is_not_authority","prime_directive_admission"],"proof_status":"IMPLEMENTED"},{"id":"FED-LEAN-011","declaration":"peering_does_not_create_trust","module":"QSOLFed.Theorems","path":"QSOLFed/Theorems.lean","source_refs":["state/phase4.json","invariants/fed-v1.json"],"contract_ids":["peering_is_not_trust","peer_admission_creates_trust=false"],"proof_status":"IMPLEMENTED"},{"id":"FED-LEAN-012","declaration":"peering_does_not_create_admission","module":"QSOLFed.Theorems","path":"QSOLFed/Theorems.lean","source_refs":["state/phase4.json","invariants/fed-v1.json"],"contract_ids":["local_sovereignty_over_federation_convenience"],"proof_status":"IMPLEMENTED"},{"id":"FED-LEAN-013","declaration":"capability_requires_explicit_local_allow","module":"QSOLFed.Theorems","path":"QSOLFed/Theorems.lean","source_refs":["state/phase4.json","invariants/fed-v1.json"],"contract_ids":["capability_is_not_entitlement","explicit_local_allow"],"proof_status":"IMPLEMENTED"},{"id":"FED-LEAN-014","declaration":"capability_requires_peer_admission","module":"QSOLFed.Theorems","path":"QSOLFed/Theorems.lean","source_refs":["state/phase4.json","invariants/fed-v1.json"],"contract_ids":["capability_is_not_entitlement","peer_lifecycle_admitted"],"proof_status":"IMPLEMENTED"},{"id":"FED-LEAN-015","declaration":"capability_requires_authenticated_advertisement","module":"QSOLFed.Theorems","path":"QSOLFed/Theorems.lean","source_refs":["state/phase4.json","invariants/fed-v1.json"],"contract_ids":["capability_is_not_entitlement","authenticated_advertisement","capability_advertisement_maximum_lifetime_seconds=3600"],"proof_status":"IMPLEMENTED"},{"id":"FED-LEAN-016","declaration":"import_preserves_foreign_identity","module":"QSOLFed.Theorems","path":"QSOLFed/Theorems.lean","source_refs":["state/phase4.json","invariants/fed-v1.json"],"contract_ids":["provenance_preserved","foreign_state_is_not_local_state"],"proof_status":"IMPLEMENTED"},{"id":"FED-LEAN-017","declaration":"import_does_not_create_local_authority","module":"QSOLFed.Theorems","path":"QSOLFed/Theorems.lean","source_refs":["state/phase4.json","invariants/fed-v1.json"],"contract_ids":["import_is_not_authority"],"proof_status":"IMPLEMENTED"},{"id":"FED-LEAN-018","declaration":"import_does_not_change_trust","module":"QSOLFed.Theorems","path":"QSOLFed/Theorems.lean","source_refs":["state/phase4.json","invariants/fed-v1.json"],"contract_ids":["import_changes_trust=false","bundle_import_trust_change=false"],"proof_status":"IMPLEMENTED"},{"id":"FED-LEAN-019","declaration":"lifecycle_append_is_monotone","module":"QSOLFed.Theorems","path":"QSOLFed/Theorems.lean","source_refs":["state/phase4.json","invariants/fed-v1.json"],"contract_ids":["identit